<!--
 Copyright (c) 2006-2009 Apple Inc. All rights reserved.

 Licensed under the Apache License, Version 2.0 (the "License");
 you may not use this file except in compliance with the License.
 You may obtain a copy of the License at

  http://www.apache.org/licenses/LICENSE-2.0

 Unless required by applicable law or agreed to in writing, software
 distributed under the License is distributed on an "AS IS" BASIS,
 WITHOUT WARRANTIES OR CONDITIONS OF ANY KIND, either express or implied.
 See the License for the specific language governing permissions and
 limitations under the License.
 -->

<!ELEMENT caldavtest (description?, require-feature?, start, test-suite*, end) >
	<!ATTLIST caldavtest ignore-all (yes|no) "no">

	<!ELEMENT description (#PCDATA)>

	<!ELEMENT require-feature feature*>
		<!ELEMENT feature (#PCDATA)>

	<!ELEMENT start (request*)>
	<!ELEMENT end (request*)>

	<!ELEMENT request (method, ruri+, header*, data?, verify*, grabheader*, grabproperty*, grabelement*)>
		<!ATTLIST request auth (yes|no) "yes"
						 user CDATA ""
						 pswd CDATA ""
						 end-delete (yes|no) "no"
						 print-response (yes|no) "no">
		
		<!ELEMENT method (#PCDATA)>
		<!ELEMENT ruri (#PCDATA)>
		<!ELEMENT header (name, value)>
			<!ELEMENT name (#PCDATA)>
			<!ELEMENT value (#PCDATA)>
		<!ELEMENT data (content-type, filepath)>
			<!ATTLIST data substitutions (yes|no) "no">
			<!ELEMENT content-type (#PCDATA)>
			<!ELEMENT filepath (#PCDATA)>

		<!ELEMENT verify (callback, arg*)>
			
				<!ELEMENT callback (#PCDATA)>
				<!ELEMENT arg (name, value+)>
		
		<!ELEMENT grabheader (name, variable)>
	
		<!ELEMENT grabproperty (property, variable)>
			<!ELEMENT property (#PCDATA)>
			<!ELEMENT variable (#PCDATA)>

		<!ELEMENT grabelement (name, variable)>

	<!ELEMENT test-suite (require-feature?, test*)>
		<!ATTLIST test-suite name CDATA #REQUIRED
							ignore (yes|no) "no">
	
		<!ELEMENT test (description?, request+)>
			<!ATTLIST test name CDATA #REQUIRED
						  count CDATA "1"
						  stats (yes|no) "no"
						  ignore (yes|no) "no">
