<?xml version="1.0" standalone="no"?>

<!DOCTYPE caldavtest SYSTEM "caldavtest.dtd">

<!--
 Copyright (c) 2006-2008 Apple Inc. All rights reserved.

 Licensed under the Apache License, Version 2.0 (the "License");
 you may not use this file except in compliance with the License.
 You may obtain a copy of the License at

  http://www.apache.org/licenses/LICENSE-2.0

 Unless required by applicable law or agreed to in writing, software
 distributed under the License is distributed on an "AS IS" BASIS,
 WITHOUT WARRANTIES OR CONDITIONS OF ANY KIND, either express or implied.
 See the License for the specific language governing permissions and
 limitations under the License.
 -->

<caldavtest>
	<description>Test the Schedule-Tag behavior</description>

	<start>
		<request user="$userid1:" pswd="$pswd1:">
			<method>GET</method>
			<ruri>$calendarpath1:/</ruri>
		</request>
		<request user="$userid2:" pswd="$pswd2:">
			<method>GET</method>
			<ruri>$calendarpath2:/</ruri>
		</request>
		<request user="$userid3:" pswd="$pswd3:">
			<method>GET</method>
			<ruri>$calendarpath3:/</ruri>
		</request>
	</start>
	
	<test-suite name='Organizer Merge - insignificant change' ignore='no'>
		<test name='1'>
			<description>Organizer invites Attendee</description>
			<request print-response='no'>
				<method>PUT</method>
				<ruri>$calendarpath1:/1.ics</ruri>
				<data>
					<content-type>text/calendar; charset=utf-8</content-type>
					<filepath>Resource/implicit/compatibility/1.ics</filepath>
				</data>
				<verify>
					<callback>statusCode</callback>
				</verify>
			</request>
		</test>
		<test name='2'>
			<description>Organizer checks data</description>
			<request print-response='no'>
				<method>GET</method>
				<ruri>$calendarpath1:/1.ics</ruri>
				<verify>
					<callback>calendarDataMatch</callback>
					<arg>
						<name>filepath</name>
						<value>Resource/implicit/compatibility/2.ics</value>
					</arg>
				</verify>
				<grabheader>
					<name>ETag</name>
					<variable>$etag-organizer:</variable>
				</grabheader>
			</request>
		</test>
		<test name='3'>
			<description>Attendee Inbox Item</description>
			<request user="$userid2:" pswd="$pswd2:" print-response='no'>
				<method>PROPFIND</method>
				<ruri>$pathprefix2:/$inbox:/</ruri>
				<header>
					<name>Depth</name>
					<value>1</value>
				</header>
				<data>
					<content-type>application/xml; charset=utf-8</content-type>
					<filepath>Resource/implicit/compatibility/3.xml</filepath>
				</data>
				<verify>
					<callback>multistatusItems</callback>
					<arg>
						<name>count</name>
						<value>1</value>
					</arg>
				</verify>
			</request>
		</test>
		<test name='4'>
			<description>Attendee has data</description>
			<request user="$userid2:" pswd="$pswd2:" print-response='no'>
				<method>GETNEW</method>
				<ruri>$calendarpath2:/</ruri>
				<verify>
					<callback>calendarDataMatch</callback>
					<arg>
						<name>filepath</name>
						<value>Resource/implicit/compatibility/4.ics</value>
					</arg>
				</verify>
			</request>
		</test>
		<test name='5'>
			<description>Attendee deletes Inbox Item</description>
			<request user="$userid2:" pswd="$pswd2:" print-response='no'>
				<method>GETNEW</method>
				<ruri>$pathprefix2:/$inbox:/</ruri>
				<verify>
					<callback>statusCode</callback>
				</verify>
			</request>
			<request user="$userid2:" pswd="$pswd2:" print-response='no'>
				<method>DELETE</method>
				<ruri>$</ruri>
				<verify>
					<callback>statusCode</callback>
					<arg>
						<name>status</name>
						<value>204</value>
					</arg>
				</verify>
			</request>
		</test>
		<test name='6'>
			<description>Attendee -> Accepted</description>
			<request user="$userid2:" pswd="$pswd2:" print-response='no'>
				<method>GETNEW</method>
				<ruri>$calendarpath2:/</ruri>
				<verify>
					<callback>statusCode</callback>
				</verify>
			</request>
			<request user="$userid2:" pswd="$pswd2:" print-response='no'>
				<method>PUT</method>
				<ruri>$</ruri>
				<data>
					<content-type>text/calendar; charset=utf-8</content-type>
					<filepath>Resource/implicit/compatibility/5.ics</filepath>
				</data>
				<verify>
					<callback>statusCode</callback>
				</verify>
			</request>
		</test>
		<test name='7'>
			<description>Organizer Inbox Item</description>
			<request print-response='no'>
				<method>PROPFIND</method>
				<ruri>$pathprefix1:/$inbox:/</ruri>
				<header>
					<name>Depth</name>
					<value>1</value>
				</header>
				<data>
					<content-type>application/xml; charset=utf-8</content-type>
					<filepath>Resource/implicit/compatibility/3.xml</filepath>
				</data>
				<verify>
					<callback>multistatusItems</callback>
					<arg>
						<name>count</name>
						<value>1</value>
					</arg>
				</verify>
			</request>
		</test>
		<test name='8'>
			<description>Organizer data changed</description>
			<request print-response='no'>
				<method>GET</method>
				<ruri>$calendarpath1:/1.ics</ruri>
				<verify>
					<callback>calendarDataMatch</callback>
					<arg>
						<name>filepath</name>
						<value>Resource/implicit/compatibility/6.ics</value>
					</arg>
				</verify>
			</request>
		</test>
		<test name='9'>
			<description>Organizer deletes Inbox Item</description>
			<request print-response='no'>
				<method>GETNEW</method>
				<ruri>$pathprefix1:/$inbox:/</ruri>
				<verify>
					<callback>statusCode</callback>
				</verify>
			</request>
			<request print-response='no'>
				<method>DELETE</method>
				<ruri>$</ruri>
				<verify>
					<callback>statusCode</callback>
					<arg>
						<name>status</name>
						<value>204</value>
					</arg>
				</verify>
			</request>
		</test>
		<test name='10'>
			<description>Organizer adds VALARM to one instance</description>
			<request print-response='no'>
				<method>PUT</method>
				<ruri>$calendarpath1:/1.ics</ruri>
				<header>
					<name>If-Match</name>
					<value>$etag-organizer:</value>
				</header>
				<data>
					<content-type>text/calendar; charset=utf-8</content-type>
					<filepath>Resource/implicit/compatibility/7.ics</filepath>
				</data>
				<verify>
					<callback>statusCode</callback>
				</verify>
			</request>
		</test>
		<test name='11'>
			<description>Organizer checks data</description>
			<request print-response='no'>
				<method>GET</method>
				<ruri>$calendarpath1:/1.ics</ruri>
				<verify>
					<callback>calendarDataMatch</callback>
					<arg>
						<name>filepath</name>
						<value>Resource/implicit/compatibility/8.ics</value>
					</arg>
				</verify>
			</request>
		</test>
		<test name='12'>
			<description>Attendee no Inbox Item</description>
			<request user="$userid2:" pswd="$pswd2:" print-response='no'>
				<method>PROPFIND</method>
				<ruri>$pathprefix2:/$inbox:/</ruri>
				<header>
					<name>Depth</name>
					<value>1</value>
				</header>
				<data>
					<content-type>application/xml; charset=utf-8</content-type>
					<filepath>Resource/implicit/compatibility/3.xml</filepath>
				</data>
				<verify>
					<callback>multistatusItems</callback>
					<arg>
						<name>count</name>
						<value>0</value>
					</arg>
				</verify>
			</request>
		</test>
		<test name='13'>
			<description>Clean-up</description>
			<request user="$userid1:" pswd="$pswd1:">
				<method>DELETEALL</method>
				<ruri>$calendarpath1:/</ruri>
			</request>
			<request user="$userid1:" pswd="$pswd1:">
				<method>DELETEALL</method>
				<ruri>$pathprefix1:/$inbox:/</ruri>
			</request>
			<request user="$userid2:" pswd="$pswd2:">
				<method>DELETEALL</method>
				<ruri>$calendarpath2:/</ruri>
			</request>
			<request user="$userid2:" pswd="$pswd2:">
				<method>DELETEALL</method>
				<ruri>$pathprefix2:/$inbox:/</ruri>
			</request>
		</test>
	</test-suite>

	<end>
		<request user="$useradmin:" pswd="$pswdadmin:">
			<method>DELETEALL</method>
			<ruri>$calendarpath1:/</ruri>
			<ruri>$pathprefix1:/$inbox:/</ruri>
			<ruri>$calendarpath2:/</ruri>
			<ruri>$pathprefix2:/$inbox:/</ruri>
			<ruri>$calendarpath3:/</ruri>
			<ruri>$pathprefix3:/$inbox:/</ruri>
		</request>
	</end>
	
</caldavtest>
