<?xml version="1.0" standalone="no"?>

<!DOCTYPE caldavtest SYSTEM "caldavtest.dtd">

<!--
 Copyright (c) 2006-2010 Apple Inc. All rights reserved.

 Licensed under the Apache License, Version 2.0 (the "License");
 you may not use this file except in compliance with the License.
 You may obtain a copy of the License at

  http://www.apache.org/licenses/LICENSE-2.0

 Unless required by applicable law or agreed to in writing, software
 distributed under the License is distributed on an "AS IS" BASIS,
 WITHOUT WARRANTIES OR CONDITIONS OF ANY KIND, either express or implied.
 See the License for the specific language governing permissions and
 limitations under the License.
 -->

<caldavtest>
	<description>Test calendar sharing invitations</description>

	<require-feature>
		<feature>caldav</feature>
		<feature>shared-calendars</feature>
	</require-feature>

	<start>
		<request user="$userid1:" pswd="$pswd1:">
			<method>DELETEALL</method>
			<ruri>$notificationpath1:/</ruri>
		</request>
		<request user="$userid2:" pswd="$pswd2:">
			<method>DELETEALL</method>
			<ruri>$notificationpath2:/</ruri>
		</request>
		<request end-delete="yes">
			<method>MKCALENDAR</method>
			<ruri>$pathprefix1:/shared/</ruri>
			<data>
				<content-type>text/xml; charset=utf-8</content-type>
				<filepath>Resource/Common/MKCALENDAR/sharedcalendar.xml</filepath>
			</data>
			<verify>
				<callback>statusCode</callback>
			</verify>
		</request>
	</start>
	
	<test-suite name='Send new invite'>
		<test name='1' ignore='no'>
			<description>POST invitation</description>
			<request print-response='no'>
				<method>POST</method>
				<ruri>$pathprefix1:/shared/</ruri>
				<data>
					<content-type>text/xml; charset=utf-8</content-type>
					<filepath>Resource/CalDAV/sharing/invites/new/1.xml</filepath>
				</data>
				<verify>
					<callback>statusCode</callback>
				</verify>
			</request>
		</test>
		<test name='2'>
			<description>Check Sharee notification collection</description>
			<request user="$userid2:" pswd="$pswd2:" print-response='no'>
				<method>WAITCOUNT 1</method>
				<ruri>$notificationpath2:/</ruri>
			</request>
			<request user="$userid2:" pswd="$pswd2:" print-response='no'>
				<method>GETNEW</method>
				<ruri>$notificationpath2:/</ruri>
				<verify>
					<callback>xmlDataMatch</callback>
					<arg>
						<name>filepath</name>
						<value>Resource/CalDAV/sharing/invites/new/2.xml</value>
					</arg>
					<arg>
						<name>filter</name>
						<value>{http://calendarserver.org/ns/}dtstamp</value>
						<value>{http://calendarserver.org/ns/}uid</value>
					</arg>
				</verify>
			</request>
		</test>
		<test name='3'>
			<description>Notification type property</description>
			<request user="$userid2:" pswd="$pswd2:" print-response='no'>
				<method>PROPFIND</method>
				<ruri>$</ruri>
				<header>
					<name>Depth</name>
					<value>0</value>
				</header>
				<data>
					<content-type>application/xml; charset=utf-8</content-type>
					<filepath>Resource/CalDAV/sharing/invites/new/3.xml</filepath>
				</data>
				<verify>
					<callback>xmlElementMatch</callback>
					<arg>
						<name>exists</name>
						<value>$verify-property-prefix:/{http://calendarserver.org/ns/}notificationtype/{http://calendarserver.org/ns/}invite-notification[@shared-type="calendar"]</value>
					</arg>
				</verify>
			</request>
		</test>
	</test-suite>
	
	<test-suite name='Update new invite'>
		<test name='1' ignore='no'>
			<description>POST invitation</description>
			<request print-response='no'>
				<method>POST</method>
				<ruri>$pathprefix1:/shared/</ruri>
				<data>
					<content-type>text/xml; charset=utf-8</content-type>
					<filepath>Resource/CalDAV/sharing/invites/updatenew/1.xml</filepath>
				</data>
				<verify>
					<callback>statusCode</callback>
				</verify>
			</request>
		</test>
		<test name='2'>
			<description>Check Sharee notification collection</description>
			<request user="$userid2:" pswd="$pswd2:" print-response='no'>
				<method>WAITCOUNT 1</method>
				<ruri>$notificationpath2:/</ruri>
			</request>
			<request user="$userid2:" pswd="$pswd2:" print-response='no'>
				<method>GETNEW</method>
				<ruri>$notificationpath2:/</ruri>
				<verify>
					<callback>xmlDataMatch</callback>
					<arg>
						<name>filepath</name>
						<value>Resource/CalDAV/sharing/invites/updatenew/2.xml</value>
					</arg>
					<arg>
						<name>filter</name>
						<value>{http://calendarserver.org/ns/}dtstamp</value>
						<value>{http://calendarserver.org/ns/}uid</value>
					</arg>
				</verify>
			</request>
		</test>
		<test name='3'>
			<description>Notification type property</description>
			<request user="$userid2:" pswd="$pswd2:" print-response='no'>
				<method>PROPFIND</method>
				<ruri>$</ruri>
				<header>
					<name>Depth</name>
					<value>0</value>
				</header>
				<data>
					<content-type>application/xml; charset=utf-8</content-type>
					<filepath>Resource/CalDAV/sharing/invites/updatenew/3.xml</filepath>
				</data>
				<verify>
					<callback>xmlElementMatch</callback>
					<arg>
						<name>exists</name>
						<value>$verify-property-prefix:/{http://calendarserver.org/ns/}notificationtype/{http://calendarserver.org/ns/}invite-notification[@shared-type="calendar"]</value>
					</arg>
				</verify>
			</request>
		</test>
	</test-suite>
	
	<test-suite name='Uninvite new invite'>
		<test name='1' ignore='no'>
			<description>POST invitation</description>
			<request print-response='no'>
				<method>POST</method>
				<ruri>$pathprefix1:/shared/</ruri>
				<data>
					<content-type>text/xml; charset=utf-8</content-type>
					<filepath>Resource/CalDAV/sharing/invites/uninvitenew/1.xml</filepath>
				</data>
				<verify>
					<callback>statusCode</callback>
				</verify>
			</request>
		</test>
		<test name='2'>
			<description>Check Sharee notification collection</description>
			<request user="$userid2:" pswd="$pswd2:" print-response='no'>
				<method>PROPFIND</method>
				<ruri>$notificationpath2:/</ruri>
				<header>
					<name>Depth</name>
					<value>1</value>
				</header>
				<data>
					<content-type>text/calendar; charset=utf-8</content-type>
					<filepath>Resource/Common/PROPFIND/count.xml</filepath>
				</data>
				<verify>
					<callback>multistatusItems</callback>
					<arg>
						<name>count</name>
						<value>0</value>
					</arg>
				</verify>
			</request>
		</test>
	</test-suite>
	
	<test-suite name='Attempt broken invite'>
		<test name='1' ignore='no'>
			<description>POST invitation</description>
			<request print-response='no'>
				<method>POST</method>
				<ruri>$pathprefix1:/shared/</ruri>
				<data>
					<content-type>text/xml; charset=utf-8</content-type>
					<filepath>Resource/CalDAV/sharing/invites/broken/1.xml</filepath>
				</data>
				<verify>
					<callback>multistatusItems</callback>
					<arg>
						<name>424</name>
						<value>$cuaddr2:</value>
					</arg>
					<arg>
						<name>403</name>
						<value>mailto:bogus@example.net</value>
					</arg>
				</verify>
			</request>
		</test>
		<test name='2'>
			<description>Check Sharee notification collection</description>
			<request user="$userid2:" pswd="$pswd2:" print-response='no'>
				<method>PROPFIND</method>
				<ruri>$notificationpath2:/</ruri>
				<header>
					<name>Depth</name>
					<value>1</value>
				</header>
				<data>
					<content-type>text/calendar; charset=utf-8</content-type>
					<filepath>Resource/Common/PROPFIND/count.xml</filepath>
				</data>
				<verify>
					<callback>multistatusItems</callback>
					<arg>
						<name>count</name>
						<value>0</value>
					</arg>
				</verify>
			</request>
		</test>
	</test-suite>
	
	<test-suite name='Delete new invite'>
		<test name='1' ignore='no'>
			<description>POST invitation</description>
			<request print-response='no'>
				<method>POST</method>
				<ruri>$pathprefix1:/shared/</ruri>
				<data>
					<content-type>text/xml; charset=utf-8</content-type>
					<filepath>Resource/CalDAV/sharing/invites/new/1.xml</filepath>
				</data>
				<verify>
					<callback>statusCode</callback>
				</verify>
			</request>
		</test>
		<test name='2'>
			<description>Check Sharee notification collection</description>
			<request user="$userid2:" pswd="$pswd2:" print-response='no'>
				<method>PROPFIND</method>
				<ruri>$notificationpath2:/</ruri>
				<header>
					<name>Depth</name>
					<value>1</value>
				</header>
				<data>
					<content-type>text/calendar; charset=utf-8</content-type>
					<filepath>Resource/Common/PROPFIND/count.xml</filepath>
				</data>
				<verify>
					<callback>multistatusItems</callback>
					<arg>
						<name>count</name>
						<value>1</value>
					</arg>
				</verify>
			</request>
		</test>
		<test name='3' ignore='no'>
			<description>DELETE collection</description>
			<request print-response='no'>
				<method>DELETE</method>
				<ruri>$pathprefix1:/shared/</ruri>
				<verify>
					<callback>statusCode</callback>
				</verify>
			</request>
		</test>
		<test name='4'>
			<description>Check Sharee notification collection</description>
			<request user="$userid2:" pswd="$pswd2:" print-response='no'>
				<method>PROPFIND</method>
				<ruri>$notificationpath2:/</ruri>
				<header>
					<name>Depth</name>
					<value>1</value>
				</header>
				<data>
					<content-type>text/calendar; charset=utf-8</content-type>
					<filepath>Resource/Common/PROPFIND/count.xml</filepath>
				</data>
				<verify>
					<callback>multistatusItems</callback>
					<arg>
						<name>count</name>
						<value>0</value>
					</arg>
				</verify>
			</request>
		</test>
	</test-suite>
	
	<end>
		<request user="$useradmin:" pswd="$pswdadmin:">
			<method>DELETEALL</method>
			<ruri>$notificationpath1:/</ruri>
			<ruri>$notificationpath2:/</ruri>
			<ruri>$notificationpath3:/</ruri>
			<ruri>$notificationpath4:/</ruri>
		</request>
	</end>

</caldavtest>
