<?xml version="1.0" standalone="no"?>

<!DOCTYPE caldavtest SYSTEM "caldavtest.dtd">

<!--
 Copyright (c) 2006-2007 Apple Inc. All rights reserved.

 Licensed under the Apache License, Version 2.0 (the "License");
 you may not use this file except in compliance with the License.
 You may obtain a copy of the License at

  http://www.apache.org/licenses/LICENSE-2.0

 Unless required by applicable law or agreed to in writing, software
 distributed under the License is distributed on an "AS IS" BASIS,
 WITHOUT WARRANTIES OR CONDITIONS OF ANY KIND, either express or implied.
 See the License for the specific language governing permissions and
 limitations under the License.
 -->

<caldavtest ignore-all="yes">
	<description>Test POST method in CalDAV</description>

	<start/>
	
	<test-suite name="POST free-busy" ignore='no'>
		<test name='1'>
			<description>POST free busy one valid user</description>
			<request print-response='yes'>
				<method>POST</method>
				<header>
					<name>Originator</name>
					<value>$cuaddr1:</value>
				</header>
				<header>
					<name>Recipient</name>
					<value>mailto:remote01@example.org</value>
				</header>
				<ruri>$pathprefix:/$outbox:/</ruri>
				<data>
					<content-type>text/calendar; charset=utf-8</content-type>
					<filepath>Resource/servertoserver/8.ics</filepath>
				</data>
				<verify>
					<callback>statusCode</callback>
				</verify>
				<verify>
					<callback>dataString</callback>
					<arg>
						<name>contains</name>
						<value>2.0;Success</value>
					</arg>
				</verify>
			</request>
		</test>
	</test-suite>
	
	<test-suite name="POST invite" ignore='no'>
		<test name='1'>
			<description>POST invite one valid user</description>
			<request print-response='yes'>
				<method>POST</method>
				<header>
					<name>Originator</name>
					<value>$cuaddr1:</value>
				</header>
				<header>
					<name>Recipient</name>
					<value>mailto:remote01@example.org</value>
				</header>
				<ruri>$pathprefix:/$outbox:/</ruri>
				<data>
					<content-type>text/calendar; charset=utf-8</content-type>
					<filepath>Resource/servertoserver/9.ics</filepath>
				</data>
				<verify>
					<callback>statusCode</callback>
				</verify>
				<verify>
					<callback>dataString</callback>
					<arg>
						<name>contains</name>
						<value>2.0;Success</value>
					</arg>
				</verify>
			</request>
		</test>
	</test-suite>
	
	<end/>
	
</caldavtest>
