<?xml version="1.0" standalone="no"?>

<!DOCTYPE caldavtest SYSTEM "caldavtest.dtd">

<!--
 Copyright (c) 2006 Apple Computer, Inc. All rights reserved.

 Licensed under the Apache License, Version 2.0 (the "License");
 you may not use this file except in compliance with the License.
 You may obtain a copy of the License at

  http://www.apache.org/licenses/LICENSE-2.0

 Unless required by applicable law or agreed to in writing, software
 distributed under the License is distributed on an "AS IS" BASIS,
 WITHOUT WARRANTIES OR CONDITIONS OF ANY KIND, either express or implied.
 See the License for the specific language governing permissions and
 limitations under the License.

 DRI: Cyrus Daboo, cdaboo@apple.com
 -->

<caldavtest>
	<description>Test PUT method in CalDAV</description>

	<start/>
	
	<test-suite name='PUT VAVAILABILITY'>
		<test name='1' ignore='no'>
			<description>PUT availability</description>
			<request end-delete="yes">
				<method>PUT</method>
				<ruri>1.ics</ruri>
				<data>
					<content-type>text/calendar; charset=utf-8</content-type>
					<filepath>Resource/availability/1.ics</filepath>
				</data>
				<verify>
					<callback>statusCode</callback>
				</verify>
				<verify>
					<callback>header</callback>
					<arg>
						<name>header</name>
						<value>ETag$\"0dd19df90dcc91cf6c549ff7ca69ca3a\"</value>
					</arg>
				</verify>
			</request>
			<request>
				<method>GET</method>
				<ruri>1.ics</ruri>
				<verify>
					<callback>dataMatch</callback>
					<arg>
						<name>filepath</name>
						<value>Resource/availability/1.ics</value>
					</arg>
				</verify>
			</request>
		</test>
	</test-suite>

	<end/>
	
</caldavtest>
