<?xml version="1.0" standalone="no"?>

<!DOCTYPE caldavtest SYSTEM "caldavtest.dtd">

<!--
 Copyright (c) 2006-2013 Apple Inc. All rights reserved.

 Licensed under the Apache License, Version 2.0 (the "License");
 you may not use this file except in compliance with the License.
 You may obtain a copy of the License at

  http://www.apache.org/licenses/LICENSE-2.0

 Unless required by applicable law or agreed to in writing, software
 distributed under the License is distributed on an "AS IS" BASIS,
 WITHOUT WARRANTIES OR CONDITIONS OF ANY KIND, either express or implied.
 See the License for the specific language governing permissions and
 limitations under the License.
 -->

<caldavtest>
	<description>Test implicit scheduling for auto-accept where proxy change is preserved</description>

	<require-feature>
		<feature>caldav</feature>
		<feature>auto-accept</feature>
		<feature>implicit-scheduling</feature>
	</require-feature>

	<start/>
	
	<test-suite name='#1 Decline one valid instance'>
		<test name='1'>
			<description>Create new event</description>
			<request>
				<method>PUT</method>
				<ruri>$calendarpath1:/1.ics</ruri>
				<data>
					<content-type>text/calendar; charset=utf-8</content-type>
					<filepath>Resource/CalDAV/implicit/auto9/suite1/1.ics</filepath>
				</data>
				<verify>
					<callback>statusCode</callback>
				</verify>
			</request>
		</test>
		<test name='2'>
			<description>One item in user01 Inbox</description>
			<request>
				<method>WAITDELETEALL 1</method>
				<ruri>$inboxpath1:/</ruri>
			</request>
		</test>
		<test name='3'>
			<description>One item in user01 Calendar</description>
			<request>
				<method>GET</method>
				<ruri>$calendarpath1:/1.ics</ruri>
				<verify>
					<callback>calendarDataMatch</callback>
					<arg>
						<name>filepath</name>
						<value>Resource/CalDAV/implicit/auto9/suite1/2.ics</value>
					</arg>
				</verify>
			</request>
		</test>
		<test name='4'>
			<description>No items in resource01 Inbox</description>
			<request user="$useradmin:" pswd="$pswdadmin:">
				<method>PROPFIND</method>
				<ruri>$rinboxpath1:/</ruri>
				<header>
					<name>Depth</name>
					<value>1</value>
				</header>
				<data>
					<content-type>text/xml; charset=utf-8</content-type>
					<filepath>Resource/Common/PROPFIND/count.xml</filepath>
				</data>
				<verify>
					<callback>multistatusItems</callback>
					<arg>
						<name>count</name>
						<value>0</value>
					</arg>
				</verify>
			</request>
		</test>
		<test name='5'>
			<description>One item in resource01 Calendar</description>
			<request user="$useradmin:" pswd="$pswdadmin:">
				<method>GETNEW</method>
				<ruri>$rcalendarpath1:/</ruri>
				<verify>
					<callback>calendarDataMatch</callback>
					<arg>
						<name>filepath</name>
						<value>Resource/CalDAV/implicit/auto9/suite1/3.ics</value>
					</arg>
				</verify>
			</request>
		</test>
		<test name='6'>
			<description>Proxy decline resource01 Calendar</description>
			<request>
				<method>PUT</method>
				<ruri>$</ruri>
				<data>
					<content-type>text/calendar; charset=utf-8</content-type>
					<filepath>Resource/CalDAV/implicit/auto9/suite1/4.ics</filepath>
				</data>
				<verify>
					<callback>statusCode</callback>
				</verify>
			</request>
		</test>
		<test name='7'>
			<description>One item in user01 Inbox</description>
			<request>
				<method>WAITDELETEALL 1</method>
				<ruri>$inboxpath1:/</ruri>
			</request>
		</test>
		<test name='8'>
			<description>One item in user01 Calendar</description>
			<request>
				<method>GET</method>
				<ruri>$calendarpath1:/1.ics</ruri>
				<verify>
					<callback>calendarDataMatch</callback>
					<arg>
						<name>filepath</name>
						<value>Resource/CalDAV/implicit/auto9/suite1/5.ics</value>
					</arg>
				</verify>
			</request>
		</test>
		<test name='9'>
			<description>Update event summary - resource partstat unchanged</description>
			<request>
				<method>PUT</method>
				<ruri>$calendarpath1:/1.ics</ruri>
				<data>
					<content-type>text/calendar; charset=utf-8</content-type>
					<filepath>Resource/CalDAV/implicit/auto9/suite1/6.ics</filepath>
				</data>
				<verify>
					<callback>statusCode</callback>
				</verify>
			</request>
			<request>
				<method>DELAY</method>
				<ruri>1</ruri>
			</request>
		</test>
		<test name='10'>
			<description>No items in user01 Inbox</description>
			<request>
				<method>PROPFIND</method>
				<ruri>$inboxpath1:/</ruri>
				<header>
					<name>Depth</name>
					<value>1</value>
				</header>
				<data>
					<content-type>text/xml; charset=utf-8</content-type>
					<filepath>Resource/Common/PROPFIND/count.xml</filepath>
				</data>
				<verify>
					<callback>multistatusItems</callback>
					<arg>
						<name>count</name>
						<value>0</value>
					</arg>
				</verify>
			</request>
		</test>
		<test name='11'>
			<description>One item in user01 Calendar</description>
			<request>
				<method>GET</method>
				<ruri>$calendarpath1:/1.ics</ruri>
				<verify>
					<callback>calendarDataMatch</callback>
					<arg>
						<name>filepath</name>
						<value>Resource/CalDAV/implicit/auto9/suite1/7.ics</value>
					</arg>
				</verify>
			</request>
		</test>
		<test name='12'>
			<description>No items in resource01 Inbox</description>
			<request user="$useradmin:" pswd="$pswdadmin:">
				<method>PROPFIND</method>
				<ruri>$rinboxpath1:/</ruri>
				<header>
					<name>Depth</name>
					<value>1</value>
				</header>
				<data>
					<content-type>text/xml; charset=utf-8</content-type>
					<filepath>Resource/Common/PROPFIND/count.xml</filepath>
				</data>
				<verify>
					<callback>multistatusItems</callback>
					<arg>
						<name>count</name>
						<value>0</value>
					</arg>
				</verify>
			</request>
		</test>
		<test name='13'>
			<description>One item in resource01 Calendar</description>
			<request user="$useradmin:" pswd="$pswdadmin:">
				<method>GETNEW</method>
				<ruri>$rcalendarpath1:/</ruri>
				<verify>
					<callback>calendarDataMatch</callback>
					<arg>
						<name>filepath</name>
						<value>Resource/CalDAV/implicit/auto9/suite1/8.ics</value>
					</arg>
				</verify>
			</request>
		</test>
		<test name='14'>
			<description>Re-invite declined instance</description>
			<request>
				<method>PUT</method>
				<ruri>$calendarpath1:/1.ics</ruri>
				<data>
					<content-type>text/calendar; charset=utf-8</content-type>
					<filepath>Resource/CalDAV/implicit/auto9/suite1/9.ics</filepath>
				</data>
				<verify>
					<callback>statusCode</callback>
				</verify>
			</request>
		</test>
		<test name='15'>
			<description>One item in user01 Inbox</description>
			<request>
				<method>WAITDELETEALL 1</method>
				<ruri>$inboxpath1:/</ruri>
			</request>
		</test>
		<test name='16'>
			<description>One item in user01 Calendar</description>
			<request>
				<method>GET</method>
				<ruri>$calendarpath1:/1.ics</ruri>
				<verify>
					<callback>calendarDataMatch</callback>
					<arg>
						<name>filepath</name>
						<value>Resource/CalDAV/implicit/auto9/suite1/10.ics</value>
					</arg>
				</verify>
			</request>
		</test>
		<test name='17'>
			<description>No items in resource01 Inbox</description>
			<request user="$useradmin:" pswd="$pswdadmin:">
				<method>PROPFIND</method>
				<ruri>$rinboxpath1:/</ruri>
				<header>
					<name>Depth</name>
					<value>1</value>
				</header>
				<data>
					<content-type>text/xml; charset=utf-8</content-type>
					<filepath>Resource/Common/PROPFIND/count.xml</filepath>
				</data>
				<verify>
					<callback>multistatusItems</callback>
					<arg>
						<name>count</name>
						<value>0</value>
					</arg>
				</verify>
			</request>
		</test>
		<test name='18'>
			<description>One item in resource01 Calendar</description>
			<request user="$useradmin:" pswd="$pswdadmin:">
				<method>GETNEW</method>
				<ruri>$rcalendarpath1:/</ruri>
				<verify>
					<callback>calendarDataMatch</callback>
					<arg>
						<name>filepath</name>
						<value>Resource/CalDAV/implicit/auto9/suite1/11.ics</value>
					</arg>
				</verify>
			</request>
		</test>
		<test name='-1'>
			<description>Clean-up inboxes</description>
			<request>
				<method>DELETEALL</method>
				<ruri>$inboxpath1:/</ruri>
			</request>
			<request user="$useradmin:" pswd="$pswdadmin:">
				<method>DELETEALL</method>
				<ruri>$rinboxpath1:/</ruri>
			</request>
		</test>
	</test-suite>

	<end>
		<request>
			<method>DELETEALL</method>
			<ruri>$inboxpath1:/</ruri>
			<ruri>$calendarpath1:/</ruri>
		</request>
		<request user="$useradmin:" pswd="$pswdadmin:">
			<method>WAITCOUNT 0</method>
			<ruri>$rcalendarpath1:/</ruri>
		</request>
	</end>
	
</caldavtest>
