<?xml version="1.0" standalone="no"?>

<!DOCTYPE caldavtest SYSTEM "caldavtest.dtd">

<!--
 Copyright (c) 2006-2010 Apple Inc. All rights reserved.

 Licensed under the Apache License, Version 2.0 (the "License");
 you may not use this file except in compliance with the License.
 You may obtain a copy of the License at

  http://www.apache.org/licenses/LICENSE-2.0

 Unless required by applicable law or agreed to in writing, software
 distributed under the License is distributed on an "AS IS" BASIS,
 WITHOUT WARRANTIES OR CONDITIONS OF ANY KIND, either express or implied.
 See the License for the specific language governing permissions and
 limitations under the License.
 -->

<caldavtest>
	<require-feature>
		<feature>carddav</feature>
	</require-feature>

	<start/>
	
	<test-suite name='MKCOL with body'>
		<test name='1'>
			<description>MKCOL with correct request body</description>
			<request end-delete='yes'>
				<method>MKCOL</method>
				<ruri>$addressbookhome1:/adbktest1/</ruri>
				<data>
					<content-type>text/xml; charset=utf-8</content-type>
					<filepath>Resource/CardDAV/mkcol/1.xml</filepath>
				</data>
				<verify>
					<callback>statusCode</callback>
					<arg>
						<name>status</name>
						<value>201</value>
					</arg>
				</verify>
			</request>
		</test>
		<test name='2'>
			<description>MKCOL with correct request body on existing resource</description>
			<request>
				<method>MKCOL</method>
				<ruri>$addressbookhome1:/adbktest1/</ruri>
				<data>
					<content-type>text/xml; charset=utf-8</content-type>
					<filepath>Resource/CardDAV/mkcol/1.xml</filepath>
				</data>
				<verify>
					<callback>prepostcondition</callback>
					<arg>
						<name>error</name>
						<value>{DAV:}resource-must-be-null</value>
					</arg>
				</verify>
			</request>
		</test>
 		<test name='3'>
			<description>MKCOL with incorrect request body</description>
			<request end-delete='yes' print-response='no'>
				<method>MKCOL</method>
				<ruri>$addressbookhome1:/adbktest2/</ruri>
				<data>
					<content-type>text/xml; charset=utf-8</content-type>
					<filepath>Resource/CardDAV/mkcol/2.xml</filepath>
				</data>
				<verify>
					<callback>propfindItems</callback>
					<arg>
						<name>badprops</name>
						<value>{DAV:}resourcetype</value>
						<value>{DAV:}getetag</value>
						<value>{DAV:}displayname</value>
						<value>{urn:ietf:params:xml:ns:carddav}addressbook-description</value>
					</arg>
				</verify>
			</request>
			<request print-response='no'>
				<method>GET</method>
				<ruri>$addressbookhome1:/adbktest2/</ruri>
				<verify>
					<callback>statusCode</callback>
					<arg>
						<name>status</name>
						<value>404</value>
					</arg>
				</verify>
			</request>
		</test>
		<test name='4'>
			<description>MKCOL with incorrect request body on existing resource</description>
			<request>
				<method>MKCOL</method>
				<ruri>$addressbookhome1:/adbktest1/</ruri>
				<data>
					<content-type>text/xml; charset=utf-8</content-type>
					<filepath>Resource/CardDAV/mkcol/2.xml</filepath>
				</data>
				<verify>
					<callback>prepostcondition</callback>
					<arg>
						<name>error</name>
						<value>{DAV:}resource-must-be-null</value>
					</arg>
				</verify>
			</request>
		</test>
		<test name='5'>
			<description>MKCOL with incorrect resourcetype on new resource</description>
			<request>
				<method>MKCOL</method>
				<ruri>$addressbookhome1:/adbktest3/</ruri>
				<data>
					<content-type>text/xml; charset=utf-8</content-type>
					<filepath>Resource/CardDAV/mkcol/3.xml</filepath>
				</data>
				<verify>
					<callback>statusCode</callback>
					<arg>
						<name>status</name>
						<value>400</value>
					</arg>
				</verify>
			</request>
		</test>
	</test-suite>

	<end/>

</caldavtest>
